root@comp3134-Winter2025:~# sudo tcpdump -i any port 80 -c 10
tcpdump: data link type LINUX_SLL2
tcpdump: verbose output suppressed, use -v[v]... for full protocol decode
listening on any, link-type LINUX_SLL2 (Linux cooked v2), snapshot length 262144 bytes
04:43:11.387633 eth0  In  IP undefined.hostname.localhost.44412 > comp3134-Winter2025.http: Flags [S], seq 3823213237, win 1025, options [mss 1460], length 0
04:43:11.387733 eth0  Out IP comp3134-Winter2025.http > undefined.hostname.localhost.44412: Flags [S.], seq 1574728663, ack 3823213238, win 64240, options [mss 1460], length 0
04:43:11.480147 eth0  In  IP undefined.hostname.localhost.44412 > comp3134-Winter2025.http: Flags [R], seq 3823213238, win 0, length 0
04:43:11.480147 eth0  In  IP undefined.hostname.localhost.44412 > comp3134-Winter2025.http: Flags [R], seq 3823213238, win 1200, options [mss 1460], length 0

